{
  "$schema": "./schema/courses.schema.json",
  "lastVerified": "2026-09-30",
  "note": "Part IA, locked until the Phase B gate passes. Edit this file freely: scripts/cambridge/scrape.mjs refreshes only sheet and notes links, sheetYear, siteNote and verified flags, and never deletes an edit.",
  "scrapedAt": "2026-09-30",
  "unlock": {
    "afterGate": "B"
  },
  "cadence": {
    "sheetsPerCourse": 4,
    "supervisionsPerSheet": 1,
    "coursesAtOnce": 2
  },
  "supervisionPrompt": "{course} supervisor, example sheet {n}",
  "order": [
    [
      "ia-numbers-and-sets",
      "ia-vectors-and-matrices"
    ],
    [
      "ia-analysis-i",
      "ia-probability"
    ],
    [
      "ia-groups",
      "ia-differential-equations"
    ]
  ],
  "terms": [
    {
      "id": "michaelmas",
      "name": "Fall",
      "cambridge": "Michaelmas",
      "optional": false,
      "pure": [
        "ia-numbers-and-sets",
        "ia-groups"
      ],
      "applied": [
        "ia-vectors-and-matrices",
        "ia-differential-equations"
      ]
    },
    {
      "id": "lent",
      "name": "Winter",
      "cambridge": "Lent",
      "optional": false,
      "pure": [
        "ia-analysis-i",
        "ia-probability"
      ],
      "applied": [
        "ia-vector-calculus",
        "ia-dynamics-and-relativity"
      ]
    },
    {
      "id": "easter",
      "name": "Spring",
      "cambridge": "Easter",
      "optional": true,
      "pure": [
        "ia-optimisation"
      ],
      "applied": [
        "ia-variational-principles"
      ]
    }
  ],
  "courses": [
    {
      "id": "ia-numbers-and-sets",
      "name": "Numbers and Sets",
      "term": "michaelmas",
      "side": "pure",
      "page": "https://www.dpmms.cam.ac.uk/study/IA/Numbers%2BSets/",
      "sheetYear": "2025-2026",
      "sheets": [
        {
          "n": 1,
          "label": "Example sheet 1",
          "url": "https://www.dpmms.cam.ac.uk/study/IA/Numbers%2BSets/2025-2026/NS_1_probs.pdf",
          "verified": true,
          "questions": []
        },
        {
          "n": 2,
          "label": "Example sheet 2",
          "url": "https://www.dpmms.cam.ac.uk/study/IA/Numbers%2BSets/2025-2026/NS_2_probs.pdf",
          "verified": true,
          "questions": []
        },
        {
          "n": 3,
          "label": "Example sheet 3",
          "url": "https://www.dpmms.cam.ac.uk/study/IA/Numbers%2BSets/2025-2026/NS_3_probs.pdf",
          "verified": true,
          "questions": []
        },
        {
          "n": 4,
          "label": "Example sheet 4",
          "url": "https://www.dpmms.cam.ac.uk/study/IA/Numbers%2BSets/2025-2026/NS_4_probs.pdf",
          "verified": true,
          "questions": []
        }
      ],
      "notes": [
        {
          "label": "Dexter Chua, student notes (PDF)",
          "kind": "student",
          "url": "https://dec41.user.srcf.net/notes/IA_M/numbers_and_sets.pdf",
          "verified": true
        },
        {
          "label": "Notes Hub: more student notes for this course",
          "kind": "hub",
          "url": "https://at2027.user.srcf.net/IA.html",
          "verified": true
        }
      ],
      "pastPapers": "partIA",
      "schedule": "schedules",
      "supervisionPrompt": "Numbers and Sets supervisor, example sheet {n}",
      "siteNote": "This year's sheets are not posted yet; the 2025-2026 sheets come from the previous-years page."
    },
    {
      "id": "ia-groups",
      "name": "Groups",
      "term": "michaelmas",
      "side": "pure",
      "page": "https://www.dpmms.cam.ac.uk/study/IA/Groups/",
      "sheetYear": "2025-2026",
      "sheets": [
        {
          "n": 1,
          "label": "Example sheet 1",
          "url": "https://www.dpmms.cam.ac.uk/study/IA/Groups/2025-2026/Groups%20Example%20Sheet%201%202025.pdf",
          "verified": true,
          "questions": []
        },
        {
          "n": 2,
          "label": "Example sheet 2",
          "url": "https://www.dpmms.cam.ac.uk/study/IA/Groups/2025-2026/Groups%20Example%20Sheet%202%202025.pdf",
          "verified": true,
          "questions": []
        },
        {
          "n": 3,
          "label": "Example sheet 3",
          "url": "https://www.dpmms.cam.ac.uk/study/IA/Groups/2025-2026/Groups%20Example%20Sheet%203%202025.pdf",
          "verified": true,
          "questions": []
        },
        {
          "n": 4,
          "label": "Example sheet 4",
          "url": "https://www.dpmms.cam.ac.uk/study/IA/Groups/2025-2026/Groups%20Example%20Sheet%204%202025.pdf",
          "verified": true,
          "questions": []
        }
      ],
      "notes": [
        {
          "label": "Dexter Chua, student notes (PDF)",
          "kind": "student",
          "url": "https://dec41.user.srcf.net/notes/IA_M/groups.pdf",
          "verified": true
        },
        {
          "label": "Simon Wadsley, lecturer's notes",
          "kind": "lecturer",
          "url": "https://www.dpmms.cam.ac.uk/~sjw47/LecturesM17.pdf",
          "verified": true
        },
        {
          "label": "Oscar Randal-Williams, lecturer's notes",
          "kind": "lecturer",
          "url": "https://www.dpmms.cam.ac.uk/~or257/teaching/IAGroups/2019/groups.pdf",
          "verified": true
        },
        {
          "label": "Notes Hub: more student notes for this course",
          "kind": "hub",
          "url": "https://at2027.user.srcf.net/IA.html",
          "verified": true
        }
      ],
      "pastPapers": "partIA",
      "schedule": "schedules",
      "supervisionPrompt": "Groups supervisor, example sheet {n}"
    },
    {
      "id": "ia-vectors-and-matrices",
      "name": "Vectors and Matrices",
      "term": "michaelmas",
      "side": "applied",
      "page": "https://www.damtp.cam.ac.uk/user/examples/",
      "damtpCode": "A1",
      "sheets": [
        {
          "n": 1,
          "label": "Vectors and Matrices: Example Sheet 1",
          "url": "https://www.damtp.cam.ac.uk/user/examples/A1a.pdf",
          "updated": "Mon 20 Oct 2025",
          "verified": true,
          "questions": []
        },
        {
          "n": 2,
          "label": "Vectors and Matrices: Example Sheet 2",
          "url": "https://www.damtp.cam.ac.uk/user/examples/A1b.pdf",
          "updated": "Mon 20 Oct 2025",
          "verified": true,
          "questions": []
        },
        {
          "n": 3,
          "label": "Vectors and Matrices: Example Sheet 3",
          "url": "https://www.damtp.cam.ac.uk/user/examples/A1c.pdf",
          "updated": "Mon 20 Oct 2025",
          "verified": true,
          "questions": []
        },
        {
          "n": 4,
          "label": "Vectors and Matrices: Example Sheet 4",
          "url": "https://www.damtp.cam.ac.uk/user/examples/A1d.pdf",
          "updated": "Mon 20 Oct 2025",
          "verified": true,
          "questions": []
        }
      ],
      "notes": [
        {
          "label": "Dexter Chua, student notes (PDF)",
          "kind": "student",
          "url": "https://dec41.user.srcf.net/notes/IA_M/vectors_and_matrices.pdf",
          "verified": true
        },
        {
          "label": "Notes Hub: more student notes for this course",
          "kind": "hub",
          "url": "https://at2027.user.srcf.net/IA.html",
          "verified": true
        },
        {
          "label": "Vectors and Matrices: Study Sheet 1 (DAMTP A1e)",
          "url": "https://www.damtp.cam.ac.uk/user/examples/A1e.pdf",
          "verified": true
        },
        {
          "label": "Vectors and Matrices: Study Sheet 2 (DAMTP A1f)",
          "url": "https://www.damtp.cam.ac.uk/user/examples/A1f.pdf",
          "verified": true
        }
      ],
      "pastPapers": "partIA",
      "schedule": "schedules",
      "supervisionPrompt": "Vectors and Matrices supervisor, example sheet {n}"
    },
    {
      "id": "ia-differential-equations",
      "name": "Differential Equations",
      "term": "michaelmas",
      "side": "applied",
      "page": "https://www.damtp.cam.ac.uk/user/examples/",
      "damtpCode": "A3",
      "sheets": [
        {
          "n": 1,
          "label": "Differential Equations: Examples Sheet 1",
          "url": "https://www.damtp.cam.ac.uk/user/examples/A3a.pdf",
          "updated": "Thu 9 Oct 2025",
          "verified": true,
          "questions": []
        },
        {
          "n": 2,
          "label": "Differential Equations: Examples Sheet 2",
          "url": "https://www.damtp.cam.ac.uk/user/examples/A3b.pdf",
          "updated": "Wed 22 Oct 2025",
          "verified": true,
          "questions": []
        },
        {
          "n": 3,
          "label": "Differential Equations: Examples Sheet 3",
          "url": "https://www.damtp.cam.ac.uk/user/examples/A3c.pdf",
          "updated": "Tue 4 Nov 2025",
          "verified": true,
          "questions": []
        },
        {
          "n": 4,
          "label": "Differential Equations: Examples Sheet 4",
          "url": "https://www.damtp.cam.ac.uk/user/examples/A3d.pdf",
          "updated": "Wed 19 Nov 2025",
          "verified": true,
          "questions": []
        }
      ],
      "notes": [
        {
          "label": "Dexter Chua, student notes (PDF)",
          "kind": "student",
          "url": "https://dec41.user.srcf.net/notes/IA_M/differential_equations.pdf",
          "verified": true
        },
        {
          "label": "Notes Hub: more student notes for this course",
          "kind": "hub",
          "url": "https://at2027.user.srcf.net/IA.html",
          "verified": true
        },
        {
          "label": "Differential Equations (DAMTP A3La)",
          "url": "https://www.damtp.cam.ac.uk/user/examples/A3La.pdf",
          "verified": true
        }
      ],
      "pastPapers": "partIA",
      "schedule": "schedules",
      "supervisionPrompt": "Differential Equations supervisor, example sheet {n}"
    },
    {